{
  "package_schema_version": 1,
  "package_type": "afk-low-attention-research",
  "package_id": "research-afk-shooting-stars",
  "method": "Shooting stars",
  "status": "research-proposal",
  "checked_at": "2026-08-24",
  "facts_strategy_boundary": {
    "included": [
      "Current sourced Shooting Stars access, discovery, tier, Mining-tool, depletion, stardust, experience, shop-dependency, logout/world-hop, and site-safety mechanics.",
      "Explicit deterministic, variable, and player-observed output boundaries."
    ],
    "excluded": [
      "Strategy scoring, route order, account readiness inference, recommended 99 targets, and guaranteed RNG or hourly rates.",
      "Any unattended-safety, currently available-star, player-specific cadence, transport ownership, location-access, or future-output inference."
    ]
  },
  "source_catalog": [
    {
      "id": "wiki-shooting-stars-current",
      "publisher": "Old School RuneScape Wiki",
      "kind": "wiki",
      "url": "https://oldschool.runescape.wiki/w/Shooting_Stars",
      "checked_at": "2026-08-24",
      "use": "Primary current mechanics for star worlds and landing uncertainty, tiers, Mining outputs, experience, stardust, telescope discovery, layer depletion, despawn conditions, first-finder state, and site-risk boundary."
    },
    {
      "id": "wiki-mining-current",
      "publisher": "Old School RuneScape Wiki",
      "kind": "wiki",
      "url": "https://oldschool.runescape.wiki/w/Mining",
      "checked_at": "2026-08-24",
      "use": "General Mining tool requirement and the distinction between using a pickaxe and meeting its Attack wield requirement."
    },
    {
      "id": "wiki-dusuri-star-shop-current",
      "publisher": "Old School RuneScape Wiki",
      "kind": "wiki",
      "url": "https://oldschool.runescape.wiki/w/Dusuri%27s_Star_Shop",
      "checked_at": "2026-08-24",
      "use": "Current members-only Dusuri shop location, stardust-only currency dependency, stock, and fixed listed prices."
    },
    {
      "id": "official-poll-80-shooting-stars-2023",
      "publisher": "Jagex",
      "kind": "official",
      "url": "https://secure.runescape.com/m=news/poll-80--shooting-stars-changes?oldschool=1",
      "checked_at": "2026-08-24",
      "use": "Official confirmation that nearby miners no longer accelerate depletion, plus its historical roughly-90-minute tier-9 wording retained as a duration conflict."
    }
  ],
  "access": {
    "requirements": {
      "mining_tier_gate": {
        "claim": "A crashed star begins at tier 6, 7, 8, or 9, requiring Mining 60, 70, 80, or 90 respectively; successive layers reduce the tier down to tier 1, which requires Mining 10.",
        "source_ids": ["wiki-shooting-stars-current"]
      },
      "minimum-possible-entry": {
        "claim": "Mining level 10 is the lowest tier gate, but it does not establish that an accessible tier-1 star is currently present.",
        "source_ids": ["wiki-shooting-stars-current"]
      },
      "membership-boundary": {
        "claim": "Shooting Stars can appear on free-to-play worlds, where stardust Mining experience is halved; the Dusuri shop is members-only.",
        "source_ids": ["wiki-shooting-stars-current", "wiki-dusuri-star-shop-current"]
      }
    },
    "tools": [
      {
        "item": "usable pickaxe",
        "claim": "Mining requires a pickaxe. A player may use one to mine without meeting its Attack wield requirement; the account's owned and usable pickaxe is not inferred.",
        "source_ids": ["wiki-mining-current"]
      }
    ],
    "locations": [
      {
        "name": "observed crashed-star site in a selected world",
        "claim": "Each world selects a random site from a predetermined list on its own shooting-star cycle; the package records no currently available world or landing site.",
        "source_ids": ["wiki-shooting-stars-current"]
      },
      {
        "name": "members player-owned-house telescope result",
        "claim": "A telescope in a study room can reveal an approximate next-landing area and time; it does not identify a confirmed active crash site.",
        "source_ids": ["wiki-shooting-stars-current"]
      }
    ],
    "transport_options": [
      {
        "claim": "No transport route or owned transport item is normalized. Reaching a site depends on the player-observed world, site, access state, and chosen movement method.",
        "source_ids": ["wiki-shooting-stars-current"]
      }
    ]
  },
  "preparation": {
    "inventory_inputs": [
      {
        "item": "usable pickaxe",
        "claim": "A pickaxe is the required Mining tool; no tier or inventory placement is prescribed by this package.",
        "source_ids": ["wiki-mining-current"]
      }
    ],
    "bank_inputs": [],
    "reusable_items": [
      {
        "item": "optional study-room telescope access",
        "claim": "A members telescope can narrow the next landing's approximate area and time. It is a discovery aid, not a requirement to mine an already observed star.",
        "source_ids": ["wiki-shooting-stars-current"]
      }
    ],
    "consumed_inputs": [],
    "capacity_constraints": [
      {
        "claim": "No bank, inventory, stardust balance, teleport supply, or shop-purchase capacity is assumed. Exact outputs and inventory state remain player-observed.",
        "source_ids": []
      }
    ]
  },
  "attention_profile": {
    "class": "low_attention",
    "classification_evidence": {
      "claim": "Current Wiki Mining guidance describes crashed stars as a very low-effort method and states that a player must click again when a star degrades a tier. This descriptive class does not establish unattended safety.",
      "source_ids": ["wiki-shooting-stars-current"]
    },
    "interaction_cadence": [
      {
        "claim": "While at least one player is mining, each layer depletes after a fixed 7 minutes; reselecting the star is required when it degrades a tier.",
        "evidence_type": "source",
        "source_ids": ["wiki-shooting-stars-current"],
        "interval_seconds": {
          "fixed": 420,
          "condition": "A layer is being mined by at least one player; arrival time, remaining progress, tier, interruptions, location risk, and player response time are not fixed."
        }
      },
      {
        "claim": "Actual time between player inputs, including discovery, travel, star selection, tier changes, combat response, logout, and world-hop checks, must be recorded from play rather than inferred from the layer timer.",
        "evidence_type": "player_observation",
        "source_ids": []
      }
    ],
    "player_presence_required": true,
    "unattended_safety_claim": "never_infer"
  },
  "session_mechanics": {
    "entry_condition": "The player has observed a mineable crashed star in a selected world, meets its current tier's Mining gate, and has a usable pickaxe. This does not assume a star is currently available.",
    "entry_condition_source_ids": ["wiki-shooting-stars-current", "wiki-mining-current"],
    "duration_evidence": {
      "current-wiki-model": {
        "claim": "Each mined layer has a fixed 7-minute depletion window, with a size-9 star taking up to 63 minutes across nine layers when at least one player continues mining.",
        "source_ids": ["wiki-shooting-stars-current"]
      },
      "official-historical-model": {
        "claim": "The 20 September 2023 official hotfix described a tier-9 star as taking roughly up to 90 minutes to deplete under its then-described model.",
        "source_ids": ["official-poll-80-shooting-stars-2023"]
      },
      "boundary": "Neither source is converted into a player-specific uninterrupted session, hourly result, or availability guarantee."
    },
    "session_end_events": [
      "The tier-1 final layer fully depletes and the star crumbles.",
      "A new shooting star crashes in the same world before the current one is fully mined, causing the existing star to disappear.",
      "A system update resets the shooting-star cycle and removes stars already on the ground."
    ],
    "session_end_event_evidence": [
      {
        "event": "final-layer-depletion",
        "source_ids": ["wiki-shooting-stars-current"]
      },
      {
        "event": "next-star-in-same-world",
        "source_ids": ["wiki-shooting-stars-current"]
      },
      {
        "event": "system-update-cycle-reset",
        "source_ids": ["wiki-shooting-stars-current"]
      }
    ],
    "repeatable": true,
    "offline_progression": false,
    "offline_progression_boundary": {
      "claim": "No source checked establishes offline Mining or an automatic resume after logout; this package does not model either.",
      "source_ids": ["wiki-shooting-stars-current"]
    }
  },
  "outputs": {
    "deterministic": [
      {
        "id": "xp:mining-per-stardust",
        "description": "Each successfully mined stardust awards 32 Mining XP on members worlds or 16 Mining XP on free-to-play worlds before stated equipment modifiers. This is a fixed per-success event, not a predicted total.",
        "source_ids": ["wiki-shooting-stars-current"],
        "boundary": "deterministic"
      }
    ],
    "variable": [
      {
        "id": "item:stardust",
        "description": "Stardust is acquired from mining a crashed star, but actual quantity is variable: the Wiki reports a Mining-level-scaled success roll from 29% to 46% between levels 1 and 99.",
        "source_ids": ["wiki-shooting-stars-current"],
        "boundary": "variable"
      },
      {
        "id": "item:uncut-gem-from-shooting-stars",
        "description": "The Wiki states that gems can be obtained while mining stars; no gem result or count is granted by this package.",
        "source_ids": ["wiki-shooting-stars-current"],
        "boundary": "variable"
      },
      {
        "id": "pet:rock-golem-from-shooting-stars",